Organization_ID,Admin_Role,DateOfPayment,AmountPaid,Ads
P-2,Premium,2020-06-29,9616,taffeta workrooms encomiums gaolers hummum expletives anabiosis beasted bowse vicereine zip-code remated port-bar magnified tabiyas patenter toughener problemo cordectomy cribriform encoffined islets condiment coarsest trading sea-tang hand-dye lither disquietly stammers father-god fiancé coverable techily bluffs marrows hairy-back backlifts harlock unwisely yeast raught pegma cosmids Humvees claustral tuppenny drosera cymose rejoiceth
P-1,Advertisement,2020-05-16,9764,plasticize contumacy recherche quackers pee-pee hegira famosity deepens piddly limpish benign reapplying yeoman moth-eaten Bastille alluvium half-breed proponents perturbate growling viewly oogamous extrane larboard nonflat goodlich swarming forequoted Phocaea henlike wages-man spawners disunions citrate pulsates adherer popcraft simpleness subfusk hurling umbrello covenantee inventions vulcanist pump-gear Lansing timeline storms abland Ætolia
P-2,Advertisement,2020-12-05,5691,réchauffé hand-lever grassiest Thucydides clientside divining sluicegate pretrials scourging ulnas nonsexual gambol mappable wrister chilam radionics arguidos dredged Goosnargh medallists lee-clue readout marketised greedy-gut depucelate middler night-tide cycads bipedalism chamar parishes raptness cabins anisogamy theoline bootlaces midwive zoöphites nonethical manicurist senocular satirical pit-head biathlon deglazing bitchen ferrules swamplands appliance majordomo
P-1,Global,2020-09-04,3623,cabinet dotest limitative kumiss swindling argol theomaniac soiree cushiest dashpot stumbled ploughmen waiver crotched middleman ruliest brunt Henry VI war-drum lyonnaise instructed maistow roomlike tricksier chalona loggings sea-beaver gusher opposing trumpeter nonabused gamesome inworking bassarisk through awsome satinwoods window audiometer partygoer splendour Kurdistan bone-meal consisting tufaceous apposition thine protractor rain-stone parovarium
P-2,Organisation,2020-09-10,8042,hawfinch cavort Priestley trenchant esterify tenuious chancels whirs unrolls gnomology cashless monorhyme wrest-pin crawdad Englanders acutely refining peepshows shoplifter linenette nepheline Klansman verdea peptone bow-legged faldage eldrich culms fusee Aliakbar megilp two-leafed lamp-fly perilymph fastuous tannest bitchwad coppas slackens spy-fi misgraft balzan smegging proponents plantaris fatigable comper scraich cosigning reassuring
P-1,User,2020-06-08,9490,Mosby sargasso clozes outwake atomized brightness fulfilled Eyemouth adductions rustily unsafely ingrowths shorten thinkers uppishly cameleon trodden ice-line rollers carbonara lustiness hailstone wiggly trampish tone-poem Bombes nasalized tailwinds nacking conversers pledges trustors new-to-us jadelike defamatory fox-goose drowsihed exornate acanthine wabbly necklines moon-dog morion caravaned froglet Bromberg lightened blash asaphus Russki
P-2,User,2020-08-15,5381,scran hubcap armorial simplexes cowherd brimless sweatsuit wood-elf gosport whose rhodanine leg-bail valkyria Gorbachev annoyed Mickey D sand-devil costay taigs thirstless soapmaking unbusied hilarious blowtube tawpies skywards encounters Leone spackled suckling incognitum getups henches delegees sarsenet Tánaiste standover reffo WheelTrans supergeek mammee nephoscope three-out crabgrass zymogen mogul pillowlike rundlet perversive javan
P-1,Organisation,2020-03-11,4871,testoon sailing modded ruffing bitchfest tenoroon Omolon prides excrements metathorax schmutz thumbholes unsyllabic outbidder alacritous bogging saginas Cupid paperbound wafters pronto coagulates assoyle justified gaffsail southwest extending torpidly Langtry propries camisoles Blimp unedible red-string slakeless chickera systemise dogmas dizzy ignavus should trophied areaway juiceheads boobie bifenthrin noddy bekah blogettes mellows
P-2,Support,2020-03-24,4056,juked spadix multisets course cowardice bound unawakened half-pike hookum concertise ruffle teaches librpc barless bhistee tailwhip honeybees housecats festino corals reblock blousy gossippers needled silicones foreshores sheened gatherers crustæ mimicries domelike monoculous comporting Demetrius antiphonic specified activism heralding bourne lightened Saguenay medidural fuzzless genitival marrows seizings paring knowingly plywood obispo
P-1,Technical,2020-02-22,7253,bradawl ballerina rindle metropolis sidepiece lambdoidal omnivora Anastacia planula spasmodist rustics kennings Damietta PHOSITA humankind azurn hydrophane rewalked hard-port armories virgule hares berceuse unsymmetry grayfish dogheads subsenses gourdlike Low Latin proofreads BOHICA intricate acceptants put-downs Oldsmobile yeanling preciosity drillcore nonobscene tone-poet similarity makiotoshi detecter sapient paradoxic unemulated maximax debriefing granitas paynimry
